"Status","Start Time","Stop Time","Duration in ms","Parent Suite","Suite","Sub Suite","Test Class","Test Method","Name","Description"
"broken","Wed Jun 07 18:42:55 GMT 2023","Wed Jun 07 18:42:58 GMT 2023","2590","","UITests.TestUnit","","UITests.TestUnit","swiperBannerTest","Проверка наличия и отображения баннера. Проверка его работоспособности.","Тест проверяет отображение слайдера с баннерами. Свайпает слайдер и проверяет меняется ли класс слайдера на другой, для проверки смены активных слайдов"
"broken","Wed Jun 07 18:42:58 GMT 2023","Wed Jun 07 18:42:58 GMT 2023","388","","UITests.TestUnit","","UITests.TestUnit","horizontalMenuVisibilityTest","Проверка наличия и отображения горизонтального меню. Проверка работы stick класса слайдера.","Тест проверяет наличие Горизонтального меню. Прокручивает страницу вниз, чтобы увидеть следует ли слайдер за пользователем."
"broken","Wed Jun 07 18:42:55 GMT 2023","Wed Jun 07 18:42:58 GMT 2023","2591","","UITests.TestUnit","","UITests.TestUnit","wayPracticeSiteEntranceTest","Проверка перехода на страницу PracticeSite 1","Тест проверяет переходит ли на страницу PractiseSite1 если клинуть по соответствующей ссылке в выпадающем списке в хэдере."
"broken","Wed Jun 07 18:42:58 GMT 2023","Wed Jun 07 18:42:58 GMT 2023","240","","UITests.TestUnit","","UITests.TestUnit","swiperCoursesTest","Проверка наличия и отображения слайдера с курсами. Проверка работоспособности слайдера.","Тест проверяет отображение слайдера с курсами. Свайпает слайдер и проверяет меняется ли класс слайдера на другой, для проверки смены активных слайдов"
"broken","Wed Jun 07 18:42:55 GMT 2023","Wed Jun 07 18:42:58 GMT 2023","2586","","UITests.TestUnit","","UITests.TestUnit","wayAuthorizationTest","Проверка авторизации на сайте Way2","Тест проверяет проходит авторизация на сайте Way2 при вводе учетных данных пользователя."
"broken","Wed Jun 07 18:42:58 GMT 2023","Wed Jun 07 18:42:58 GMT 2023","216","","UITests.TestUnit","","UITests.TestUnit","certificatesBlockVisibilityTest","Проверка наличия и отображения блока с Сертификатами.","Тест проверяет наличие и отображение блока с Сертификатами."
"broken","Wed Jun 07 18:42:58 GMT 2023","Wed Jun 07 18:42:58 GMT 2023","245","","UITests.TestUnit","","UITests.TestUnit","footerVisibilityTest","Проверка наличия и отображения Футера","Тест проверяет наличие и отображение Футера."
"broken","Wed Jun 07 18:42:58 GMT 2023","Wed Jun 07 18:42:58 GMT 2023","331","","UITests.TestUnit","","UITests.TestUnit","practiceSiteAuthorizationTest","Проверка авторизации на сайте Practice Site 2","Тест проверяет авторизацию на сайте Practice Site 2. Появляется ли текст о успешной авторизации после ввода учетных данных."
"broken","Wed Jun 07 18:42:58 GMT 2023","Wed Jun 07 18:42:58 GMT 2023","257","","UITests.TestUnit","","UITests.TestUnit","headerVisibilityTest","Проверка наличия и отображения контактов в Хэдере","Тест проверяет наличие блока Контактов в Хедере"
