"Status","Start Time","Stop Time","Duration in ms","Parent Suite","Suite","Sub Suite","Test Class","Test Method","Name","Description"
"passed","Wed Jun 07 20:05:11 GMT 2023","Wed Jun 07 20:05:14 GMT 2023","2631","","UITests.TestUnit","","UITests.TestUnit","footerVisibilityTest","Проверка наличия и отображения Футера","Тест проверяет наличие и отображение Футера."
"failed","Wed Jun 07 20:04:54 GMT 2023","Wed Jun 07 20:05:07 GMT 2023","12830","","UITests.TestUnit","","UITests.TestUnit","swiperBannerTest","Проверка наличия и отображения баннера. Проверка его работоспособности.","Тест проверяет отображение слайдера с баннерами. Свайпает слайдер и проверяет меняется ли класс слайдера на другой, для проверки смены активных слайдов"
"passed","Wed Jun 07 20:05:03 GMT 2023","Wed Jun 07 20:05:07 GMT 2023","4385","","UITests.TestUnit","","UITests.TestUnit","swiperCoursesTest","Проверка наличия и отображения слайдера с курсами. Проверка работоспособности слайдера.","Тест проверяет отображение слайдера с курсами. Свайпает слайдер и проверяет меняется ли класс слайдера на другой, для проверки смены активных слайдов"
"broken","Wed Jun 07 20:04:54 GMT 2023","Wed Jun 07 20:05:35 GMT 2023","41096","","UITests.TestUnit","","UITests.TestUnit","wayAuthorizationTest","Проверка авторизации на сайте Way2","Тест проверяет успешно ли проходит авторизация на сайте Way2 при вводе учетных данных пользователя."
"passed","Wed Jun 07 20:04:54 GMT 2023","Wed Jun 07 20:05:03 GMT 2023","8671","","UITests.TestUnit","","UITests.TestUnit","wayPracticeSiteEntranceTest","Проверка перехода на страницу PracticeSite 1","Тест проверяет переходит ли на страницу PractiseSite1 если клинуть по соответствующей ссылке в выпадающем списке в хэдере."
"passed","Wed Jun 07 20:05:07 GMT 2023","Wed Jun 07 20:05:11 GMT 2023","4263","","UITests.TestUnit","","UITests.TestUnit","practiceSiteAuthorizationTest","Проверка авторизации на сайте Practice Site 2","Тест проверяет авторизацию на сайте Practice Site 2. Появляется ли текст о успешной авторизации после ввода учетных данных."
"passed","Wed Jun 07 20:05:10 GMT 2023","Wed Jun 07 20:05:12 GMT 2023","2137","","UITests.TestUnit","","UITests.TestUnit","headerVisibilityTest","Проверка наличия и отображения контактов в Хэдере","Тест проверяет наличие блока Контактов в Хедере"
"passed","Wed Jun 07 20:05:07 GMT 2023","Wed Jun 07 20:05:10 GMT 2023","3027","","UITests.TestUnit","","UITests.TestUnit","horizontalMenuVisibilityTest","Проверка наличия и отображения горизонтального меню. Проверка работы stick класса слайдера.","Тест проверяет наличие Горизонтального меню. Прокручивает страницу вниз, чтобы увидеть следует ли слайдер за пользователем."
"passed","Wed Jun 07 20:05:12 GMT 2023","Wed Jun 07 20:05:14 GMT 2023","1977","","UITests.TestUnit","","UITests.TestUnit","certificatesBlockVisibilityTest","Проверка наличия и отображения блока с Сертификатами.","Тест проверяет наличие и отображение блока с Сертификатами."
